{
  "id": "01jrcasebox0000000000000l1",
  "tenant_id": "tenant-local-v1",
  "actor_user_id": "local-user",
  "matter_id": "01jrcasebox0000000000000m1",
  "kind": "filing",
  "source_rule_citation": "CPL §xx — answer due 30 days after service",
  "due_at": "2026-06-19T16:00:00.000Z",
  "owner_user_id": "local-user",
  "status": "pending",
  "met_at": null
}
